{
  "$schema": "./runtime-manifest.schema.json",
  "schemaVersion": 2,
  "manifestVersion": "2026.08.20.4",
  "description": "Pinned project-local runtimes. CUDA and cuDNN are assembled from official redistributable archives; Python is built offline from the official CPython base and a SHA-256-pinned wheelhouse.",
  "components": [
    {
      "id": "mingit",
      "displayName": "Portable MinGit",
      "required": true,
      "available": true,
      "version": "2.55.0.3",
      "license": {
        "name": "Git for Windows / GPL-2.0 and bundled notices",
        "reviewStatus": "official-upstream-download",
        "notice": "Downloaded from the official immutable Git for Windows GitHub release. Preserve bundled notices when redistributing."
      },
      "archive": {
        "name": "MinGit-2.55.0.3-64-bit.zip",
        "format": "zip",
        "sha256": "f48e2d2dc74a24454adc6d8fd0ac25bf9c2386f19cfb06202b9465aaad4f9f05",
        "urls": {
          "china": [
            "https://mirrors.huaweicloud.com/git-for-windows/v2.55.0.windows.3/MinGit-2.55.0.3-64-bit.zip"
          ],
          "official": [
            "https://github.com/git-for-windows/git/releases/download/v2.55.0.windows.3/MinGit-2.55.0.3-64-bit.zip"
          ]
        }
      },
      "install": {
        "relativePath": "_internal/git",
        "archiveRoot": ".",
        "layout": "direct",
        "requiredFreeBytes": 536870912
      },
      "validation": {
        "files": [
          {
            "path": "cmd/git.exe",
            "minBytes": 1024
          }
        ],
        "command": {
          "path": "cmd/git.exe",
          "arguments": [
            "--version"
          ],
          "outputRegex": "^git version 2\\.55\\.0(?:\\.windows\\.3)?"
        }
      }
    },
    {
      "id": "node",
      "displayName": "Portable Node.js",
      "required": true,
      "available": true,
      "version": "24.19.0",
      "license": {
        "name": "Node.js license and bundled third-party notices",
        "reviewStatus": "official-upstream-download",
        "notice": "Pinned to the same official archive and SHA-256 as webui/scripts/install-node.ps1."
      },
      "archive": {
        "name": "node-v24.19.0-win-x64.zip",
        "format": "zip",
        "sha256": "57f71ab3652e797d84acddc79c81cc9ff1c6ddb2a1974cdb83f00fee9bff4c73",
        "urls": {
          "china": [
            "https://mirrors.huaweicloud.com/nodejs/v24.19.0/node-v24.19.0-win-x64.zip"
          ],
          "official": [
            "https://nodejs.org/dist/v24.19.0/node-v24.19.0-win-x64.zip"
          ]
        }
      },
      "install": {
        "relativePath": "_internal/node",
        "archiveRoot": "node-v24.19.0-win-x64",
        "layout": "bin",
        "requiredFreeBytes": 536870912
      },
      "validation": {
        "files": [
          {
            "path": "bin/node.exe",
            "minBytes": 1024
          },
          {
            "path": "bin/npm.cmd",
            "minBytes": 32
          }
        ],
        "command": {
          "path": "bin/node.exe",
          "arguments": [
            "-p",
            "process.versions.node"
          ],
          "outputRegex": "^24\\.19\\.0$"
        }
      }
    },
    {
      "id": "cuda",
      "displayName": "CUDA 11.8 runtime DLLs",
      "required": true,
      "available": true,
      "version": "11.8-dflsn-runtime-v2",
      "license": {
        "name": "NVIDIA CUDA Toolkit EULA plus zlib license/readme",
        "reviewStatus": "official-upstream-download",
        "notice": "Each NVIDIA component is fetched from the official CUDA redist service. zlibwapi.dll is fetched from the ZLIB DLL package linked by NVIDIA's cuDNN 8.x Windows installation guide. Per-archive notices are retained beside the payload."
      },
      "artifacts": [
        {
          "id": "cuda-cudart",
          "name": "cuda_cudart-windows-x86_64-11.8.89-archive.zip",
          "format": "zip",
          "sha256": "988cc9e7d3785d4b1975521f312c57c6814cbf15e73a2b7941d961835f2a945e",
          "urls": {
            "china": [
              "https://developer.download.nvidia.cn/compute/cuda/redist/cuda_cudart/windows-x86_64/cuda_cudart-windows-x86_64-11.8.89-archive.zip"
            ],
            "official": [
              "https://developer.download.nvidia.com/compute/cuda/redist/cuda_cudart/windows-x86_64/cuda_cudart-windows-x86_64-11.8.89-archive.zip"
            ]
          },
          "archiveRoot": "cuda_cudart-windows-x86_64-11.8.89-archive",
          "files": [
            {
              "source": "bin/cudart64_110.dll",
              "target": "cudart64_110.dll"
            }
          ],
          "notices": [
            {
              "source": "LICENSE",
              "target": "_licenses/cuda-cudart-LICENSE.txt"
            }
          ]
        },
        {
          "id": "cuda-cupti",
          "name": "cuda_cupti-windows-x86_64-11.8.87-archive.zip",
          "format": "zip",
          "sha256": "a243ffc6b5cfd9ba469bc3dd02208186c4f1956e91d54e9bca295757edd9dafa",
          "urls": {
            "china": [
              "https://developer.download.nvidia.cn/compute/cuda/redist/cuda_cupti/windows-x86_64/cuda_cupti-windows-x86_64-11.8.87-archive.zip"
            ],
            "official": [
              "https://developer.download.nvidia.com/compute/cuda/redist/cuda_cupti/windows-x86_64/cuda_cupti-windows-x86_64-11.8.87-archive.zip"
            ]
          },
          "archiveRoot": "cuda_cupti-windows-x86_64-11.8.87-archive",
          "files": [
            {
              "source": "lib/cupti64_2022.3.0.dll",
              "target": "cupti64_2022.3.0.dll"
            }
          ],
          "notices": [
            {
              "source": "LICENSE",
              "target": "_licenses/cuda-cupti-LICENSE.txt"
            }
          ]
        },
        {
          "id": "libcublas",
          "name": "libcublas-windows-x86_64-11.11.3.6-archive.zip",
          "format": "zip",
          "sha256": "67b0934a6359e4ee26fff823c356021589d392c4fd49ca12624f570edc08e2b9",
          "urls": {
            "china": [
              "https://developer.download.nvidia.cn/compute/cuda/redist/libcublas/windows-x86_64/libcublas-windows-x86_64-11.11.3.6-archive.zip"
            ],
            "official": [
              "https://developer.download.nvidia.com/compute/cuda/redist/libcublas/windows-x86_64/libcublas-windows-x86_64-11.11.3.6-archive.zip"
            ]
          },
          "archiveRoot": "libcublas-windows-x86_64-11.11.3.6-archive",
          "files": [
            {
              "source": "bin/cublas64_11.dll",
              "target": "cublas64_11.dll"
            },
            {
              "source": "bin/cublasLt64_11.dll",
              "target": "cublasLt64_11.dll"
            }
          ],
          "notices": [
            {
              "source": "LICENSE",
              "target": "_licenses/libcublas-LICENSE.txt"
            }
          ]
        },
        {
          "id": "libcufft",
          "name": "libcufft-windows-x86_64-10.9.0.58-archive.zip",
          "format": "zip",
          "sha256": "a4071a85e3983bf42ea7a2e9bebe3b0b3c9ac258668580adc32ee1c385f7556f",
          "urls": {
            "china": [
              "https://developer.download.nvidia.cn/compute/cuda/redist/libcufft/windows-x86_64/libcufft-windows-x86_64-10.9.0.58-archive.zip"
            ],
            "official": [
              "https://developer.download.nvidia.com/compute/cuda/redist/libcufft/windows-x86_64/libcufft-windows-x86_64-10.9.0.58-archive.zip"
            ]
          },
          "archiveRoot": "libcufft-windows-x86_64-10.9.0.58-archive",
          "files": [
            {
              "source": "bin/cufft64_10.dll",
              "target": "cufft64_10.dll"
            },
            {
              "source": "bin/cufftw64_10.dll",
              "target": "cufftw64_10.dll"
            }
          ],
          "notices": [
            {
              "source": "LICENSE",
              "target": "_licenses/libcufft-LICENSE.txt"
            }
          ]
        },
        {
          "id": "libcurand",
          "name": "libcurand-windows-x86_64-10.3.0.86-archive.zip",
          "format": "zip",
          "sha256": "aaccf56d68a63378edc05109c233ed47e185237c8d334f9df136923440a9a6b7",
          "urls": {
            "china": [
              "https://developer.download.nvidia.cn/compute/cuda/redist/libcurand/windows-x86_64/libcurand-windows-x86_64-10.3.0.86-archive.zip"
            ],
            "official": [
              "https://developer.download.nvidia.com/compute/cuda/redist/libcurand/windows-x86_64/libcurand-windows-x86_64-10.3.0.86-archive.zip"
            ]
          },
          "archiveRoot": "libcurand-windows-x86_64-10.3.0.86-archive",
          "files": [
            {
              "source": "bin/curand64_10.dll",
              "target": "curand64_10.dll"
            }
          ],
          "notices": [
            {
              "source": "LICENSE",
              "target": "_licenses/libcurand-LICENSE.txt"
            }
          ]
        },
        {
          "id": "libcusolver",
          "name": "libcusolver-windows-x86_64-11.4.1.48-archive.zip",
          "format": "zip",
          "sha256": "965298e47640b643827cd6fe4ca5cab3c5a97b4bedc5357e9b6551298d1f9c2c",
          "urls": {
            "china": [
              "https://developer.download.nvidia.cn/compute/cuda/redist/libcusolver/windows-x86_64/libcusolver-windows-x86_64-11.4.1.48-archive.zip"
            ],
            "official": [
              "https://developer.download.nvidia.com/compute/cuda/redist/libcusolver/windows-x86_64/libcusolver-windows-x86_64-11.4.1.48-archive.zip"
            ]
          },
          "archiveRoot": "libcusolver-windows-x86_64-11.4.1.48-archive",
          "files": [
            {
              "source": "bin/cusolver64_11.dll",
              "target": "cusolver64_11.dll"